{
  "format": "tmm-scene",
  "version": 2,
  "units": "mm",
  "id": "italic-micro-38-heading-two-formulas-semicolon",
  "bounds": {
    "low": [
      0,
      0
    ],
    "high": [
      220,
      300
    ]
  },
  "entities": [
    {
      "type": "textBlock",
      "id": "italic-38-heading-two-formulas-semicolon",
      "text": "## Ведущее звено\n\n$\\sum\\overline F^{(1)}=\\overline F_{10}+\\overline F_{12}+\\overline G_1=0$;\n$M_1=M_{\\Phi1}+F_{12}h_{F12}=4344{,}9\\ \\text{Н}\\cdot\\text{м}$",
      "position": [
        10,
        180
      ],
      "fontSize": 5,
      "italic": true,
      "width": 79.496766
    }
  ]
}
