{
  "format": "tmm-scene",
  "version": 2,
  "units": "mm",
  "id": "italic-micro-15-display-fraction",
  "bounds": {
    "low": [
      0,
      0
    ],
    "high": [
      120,
      200
    ]
  },
  "entities": [
    {
      "type": "textBlock",
      "id": "italic-15-display-fraction",
      "text": "$$F=\\frac{M}{l}$$",
      "position": [
        10,
        180
      ],
      "fontSize": 5,
      "width": 50,
      "italic": true
    }
  ]
}
