{
  "format": "tmm-scene",
  "version": 2,
  "units": "mm",
  "id": "italic-micro-10-inline-decoration",
  "bounds": {
    "low": [
      0,
      0
    ],
    "high": [
      120,
      200
    ]
  },
  "entities": [
    {
      "type": "textBlock",
      "id": "italic-10-inline-decoration",
      "text": "$\\overline{F}$",
      "position": [
        10,
        180
      ],
      "fontSize": 5,
      "width": 40,
      "italic": true
    }
  ]
}
