{
  "format": "tmm-scene",
  "version": 2,
  "units": "mm",
  "id": "italic-micro-22-display-under-over",
  "bounds": {
    "low": [
      0,
      0
    ],
    "high": [
      120,
      200
    ]
  },
  "entities": [
    {
      "type": "textBlock",
      "id": "italic-22-display-under-over",
      "text": "$$\\underset{AB}{\\underline{\\overline{a}}}=0$$",
      "position": [
        10,
        180
      ],
      "fontSize": 5,
      "width": 60,
      "italic": true
    }
  ]
}
