{
  "format": "tmm-scene",
  "version": 2,
  "units": "mm",
  "id": "italic-micro-41-group3-heading-one-sum-period",
  "bounds": {
    "low": [
      0,
      0
    ],
    "high": [
      220,
      300
    ]
  },
  "entities": [
    {
      "type": "textBlock",
      "id": "italic-41-group3-heading-one-sum-period",
      "text": "## Проверка по звену 3\n\n$\\sum\\overline F^{(3)}=\\overline F_{30}+\\overline F_{34}+\\overline G_3+\\overline\\Phi_3+\\overline F_{32}=0$.",
      "position": [
        10,
        180
      ],
      "fontSize": 5,
      "italic": true,
      "width": 106.774096
    }
  ]
}
