{
  "format": "tmm-scene",
  "version": 2,
  "units": "mm",
  "id": "estimator-incremental-03",
  "bounds": { "low": [0, 0], "high": [160, 100] },
  "entities": [
    {
      "type": "textBlock",
      "id": "markdown-styles",
      "text": "## Parameters\n**bold** and *italic* words with `code` and a list:\n- first item\n- second item",
      "position": [10, 95],
      "fontSize": 5,
      "width": 70
    }
  ]
}
