{
  "format": "tmm-scene",
  "version": 2,
  "units": "mm",
  "id": "italic-micro-04-greedy-boundary",
  "bounds": {
    "low": [
      0,
      0
    ],
    "high": [
      120,
      200
    ]
  },
  "entities": [
    {
      "type": "textBlock",
      "id": "italic-04-greedy-boundary",
      "text": "one two three four",
      "position": [
        10,
        180
      ],
      "fontSize": 5,
      "width": 18,
      "italic": true
    }
  ]
}
